{
  "id": "warehouse_collector",
  "map": "test_island_20x20",
  "steps": [
    { "op": "settle" },
    { "op": "build", "building": "LUMBERJACK", "x": 30, "y": 30 },
    { "op": "alter_storage", "target": "building", "resource": "BOARDS", "amount": 10 },
    { "op": "run_seconds", "seconds": 90 }
  ],
  "expect": {
    "min_settlement": { "BOARDS": 4 }
  }
}
