{
  "id": "pavilion",
  "map": "test_island_20x20",
  "steps": [
    { "op": "settle" },
    { "op": "build", "building": "PAVILION", "x": 30, "y": 30 },
    { "op": "run_seconds", "seconds": 30 }
  ],
  "expect": {
    "min_building_storage": {
      "stem": "pavilion",
      "x": 30,
      "y": 30,
      "resource": "FAITH",
      "min": 1
    }
  }
}
