{
  "id": "tier1_starter",
  "map": "test_island_20x20",
  "steps": [
    { "op": "settle" },
    { "op": "build", "building": "LUMBERJACK", "x": 30, "y": 30 },
    { "op": "build", "building": "HUNTER", "x": 32, "y": 30 },
    { "op": "alter_storage", "target": "building", "resource": "DEER_MEAT", "amount": 2 },
    { "op": "run_seconds", "seconds": 15 },
    { "op": "build_ownerless", "building": "FISH_DEPOSIT", "x": 35, "y": 20 },
    { "op": "build_ownerless", "building": "FISH_DEPOSIT", "x": 37, "y": 20 },
    { "op": "build_ownerless", "building": "FISH_DEPOSIT", "x": 39, "y": 20 },
    { "op": "build", "building": "FISHER", "x": 33, "y": 21 },
    { "op": "run_seconds", "seconds": 25 },
    { "op": "alter_storage", "target": "building", "resource": "BOARDS", "amount": 10 },
    { "op": "run_seconds", "seconds": 90 }
  ],
  "expect": {
    "min_settlement": { "BOARDS": 4 }
  }
}
