{
  "id": "farm_crop",
  "map": "test_island_20x20",
  "steps": [
    { "op": "settle" },
    { "op": "build", "building": "FARM", "x": 30, "y": 30 },
    { "op": "alter_storage", "target": "building", "resource": "GRAIN", "amount": 3 },
    { "op": "run_seconds", "seconds": 90 }
  ],
  "expect": {
    "min_building_storage": {
      "stem": "farm",
      "x": 30,
      "y": 30,
      "resource": "CORN",
      "min": 1
    }
  }
}
